ticker,company,sector,market_cap,description,combs_score,weschler_score,combined_score,combs_unit_economics,combs_frictionless,combs_capital_allocation,combs_moat,weschler_variant,weschler_complexity,weschler_distressed,weschler_quality,weschler_compounding,combs_style_flag,weschler_style_flag,trailing_pe,forward_pe,peg_ratio,price_to_book,price_to_sales,roic,roe,fcf_yield,gross_margin,operating_margin,net_margin,revenue_cagr_3y,revenue_cagr_5y,earnings_cagr_3y,earnings_cagr_5y,debt_to_equity,interest_coverage,altman_z,drawdown_52w,price_vs_200ma,current_price,short_percent,analyst_count,dividend_yield,margin_stability,margin_trend,earnings_consistency,revenue_stability,book_value_growth,reinvestment_rate,pe_gap,beta
RMD,ResMed Inc.,Health Care,33277392896.0,"ResMed Inc. develops, manufactures, distributes, and markets medical devices and cloud-based software applications to diagnose, treat, and manage respiratory disorders in the United States and internationally. The company operates in two segments, Sleep and Breathing Health, and Residential Care Software. It offers sleep recorders for the diagnosis and titration of sleep apnea in sleep clinics, hospitals, and at home, including ApneaLink Air, a portable diagnostic device that measures oximetry, respiratory effort, pulse, nasal flow, and snoring; NightOwl, a portable, cloud-connected, and disposable diagnostic device that measures AHI based on derived peripheral arterial tone, actigraphy, and oximetry; and EasyCare Tx, a sleep lab solution. The company also provides AirView, a cloud-based system that enables remote monitoring and changing of patients' device settings; myAir, a personalized therapy management application for patients with sleep apnea that provides support, education, and troubleshooting tools for increased patient engagement and improved compliance; and connectivity module which provides a cellular connection between compatible ventilation devices and AirView system. In addition, the company offers Brightree solutions which are solutions and services for organizations in home medical equipment and pharmacy, orthotic and prosthetic, and home infusion; HEALTHCAREfirst solutions that offers electronic health record, software, billing and coding services, and advanced analytics that enables home health and hospice agencies to optimize clinical, financial and administrative processes; MatrixCare EHR software as a service solutions used by skilled nursing and senior living providers, life plan communities, and home health and hospice sectors; and MEDIFOX DAN software solutions that is used by residential care providers, such as home health and nursing home providers. ResMed Inc. was founded in 1989 and is headquartered in San Diego, California.",67.1086031200281,54.29420736454972,60.701405242288914,18.33487028406123,13.813550733913637,17.68863657710579,17.27154552494745,8.99753086419753,10.403450340543372,12.569156500261956,10.68642160540135,11.637648054145515,True,False,22.820822,18.72421,,5.2537217,6.1646276,0.2511360724500488,0.23471114180144,0.049611638903312244,0.5936214313626009,0.3278831679370549,0.27217916778315876,0.12879187738214926,,0.2157858391255143,,0.1427334325425584,,11.766125396775061,-0.16385812990581264,-0.09593565423335751,227.97999572753906,0.0936,15.0,1.04,0.02445217971485947,0.04780646859127985,0.7370865788206846,0.8481095608584154,0.2109533297663857,0.08392898469141195,-0.17951202634155775,0.928
COO,"The Cooper Companies, Inc.",Health Care,13942875136.0,"The Cooper Companies, Inc., together with its subsidiaries, develops, manufactures, and markets contact lens wearers. The company operates in two segments, CooperVision and CooperSurgical. The CooperVision segment offers spherical, toric, and multifocal contact lenses that address vision challenges, such as astigmatism, presbyopia, and myopia. Its CooperSurgical segment focuses on family and women's health care, which provides fertility products and services, medical devices, and contraception, as well as cryostorage, such as cord blood and cord tissue storage. This segment offers Paragard, a hormone-free intrauterine device; and fertility consumables and equipment, donor gamete services, and genomic services, including genetic testing. The company sells its products to distributors, group purchasing organizations, eye care and health care professionals, including independent practices, corporate retailers, hospitals and clinics, and authorized resellers. The Cooper Companies, Inc. was founded in 1958 and is headquartered in San Ramon, California.",43.47225332468552,51.34694946214152,47.40960139341352,14.00265960647812,9.232030849974398,7.110704092860922,13.126858775372078,10.65679012345679,10.885851144589262,12.129379751301762,9.23897243602551,8.435956006768189,False,False,35.73,14.24377,,1.6669388,3.3582723,0.04250033167691866,0.04550364733156125,0.03110549264550195,0.6553855928061773,0.16687029615873325,0.09160883589091975,0.07346203139761864,,-0.009507771498270756,,0.30408185558751777,6.829,3.4802029970943487,-0.14593043326974137,-0.040109620767358245,71.45999908447266,0.0327,15.0,0.0,0.014714199699667715,0.013442657420974807,0.8738671777224379,0.9075970251860964,0.04719091041936907,0.13063239175056202,-0.6013498460677302,1.074
WAT,Waters Corporation,Health Care,31162058752.0,"Waters Corporation provides analytical workflow solutions in Asia, the Americas, and Europe. The company operates through two segments, Waters and TA. The company designs, manufactures, sells, and services liquid chromatography, as well as mass spectrometry (MS) technology systems and supports products, including chromatography columns, and other consumable products. It also designs, manufactures, sells, and services thermal analysis, rheometry, and calorimetry instruments for use in predicting the suitability and stability of fine chemicals, pharmaceuticals, water, polymers, metals, and viscous liquids for various industrial, consumer goods, and healthcare products, as well as for life science research; and develops and supplies software-based products that interface with its instruments, as well as other manufacturers' instruments. In addition, the company offers MS technology, which is used in drug discovery and development comprising clinical trial testing, the analysis of proteins in disease processes, nutritional safety analysis, and environmental testing. Its products are used by clinical, pharmaceutical, biochemical, industrial, nutritional safety, environmental, academic, and governmental customers working in research and development, quality assurance, and other laboratory applications. The company was founded in 1958 and is headquartered in Milford, Massachusetts.",55.74288852689533,53.02514500842324,54.38401676765928,16.976123657810334,11.76019265232975,14.566695668724819,12.43987654803043,9.654320987654321,5.703679151474975,9.953099105071262,16.473521229535717,11.24052453468697,False,False,29.57635,19.386597,,7.3853197,9.844943,0.1972133337951414,0.2509052248869884,0.01732266806554797,0.5928260511056505,0.2535593940010476,0.20302399214478564,0.021229912681812513,,-0.03166463919712337,,0.5821722429977332,11.540058664519469,11.68419101344266,-0.21260724970605405,-0.045743638206119,317.6499938964844,0.030299999,22.0,0.0,0.018202084245296245,-0.043615934301255654,0.9490603567428114,0.9662293753521664,0.7186993979897602,0.09744964594036684,-0.3445236819282975,1.203
STE,STERIS plc,Health Care,21960392704.0,"STERIS plc provides infection prevention products and services worldwide. It operates in three segments: Healthcare, Applied Sterilization Technologies (AST), and Life Sciences. The Healthcare segment offers cleaning chemistries and sterility assurance products; automated endoscope reprocessing system and tracking products; endoscopy accessories, washers, sterilizers, and other pieces of capital equipment for the operation of a sterile processing department; and equipment used directly in procedure rooms, including surgical tables, lights, and connectivity solutions, as well as equipment management services. It also provides capital equipment installation, maintenance, upgradation, repair, and troubleshooting services; preventive maintenance programs and repair services; instrument, devices, and endoscope repair and maintenance services; and custom process improvement consulting and outsourced instrument sterile processing services. The AST segment provides contract sterilization and testing services for medical device and pharmaceutical manufacturers through a network of contract sterilization and laboratory facilities, as well as integrated sterilization equipment and control systems to medical device manufacturers and research institutions. The Life Sciences segment designs, manufactures, and sells consumable products, such as pharmaceutical detergents, cleanroom disinfectants and sterilants, pharmaceutical grade and research sterilizers and washers, sterility assurance and maintenance products, vaporized hydrogen peroxide room decontamination systems and sterilizers, and high purity water and pure steam generators. This segment also offers equipment installation, maintenance, upgradation, repair, and troubleshooting services; and preventive maintenance programs and repair services. It serves its products and services to hospitals, other healthcare providers, and pharmaceutical manufacturers. The company was founded in 1985 and is headquartered in Mentor, Ohio.",43.11151297917337,52.02807477240234,47.56979387578785,10.718469986439121,9.634643283836834,10.015262128608086,12.743137580289332,9.516049382716048,9.729099618292045,11.969773434409316,7.974508120500644,12.83864421648429,False,False,31.337536,20.196321,,3.0679684,3.768074,0.08547472401462478,0.09307940373186258,0.035427235317986416,0.4401057603102107,0.17599365511405318,0.11258161210290658,0.08934099202562651,0.08934099202562651,0.3608503358835842,0.3608503358835842,0.33354610235174126,11.138753318417361,5.013847829290352,-0.15758211599262764,-0.07823563435125418,223.75,0.020499999,7.0,1.1,0.030019170913840633,0.06284721846095614,0.35619969857988,0.8839982705773316,0.0036124259883791865,0.08750575829537972,-0.35552300602063924,1.07
DGX,Quest Diagnostics Incorporated,Health Care,21895622656.0,"Quest Diagnostics Incorporated provides diagnostic testing and services in the United States. The company develops and delivers diagnostic information services, such as routine, non-routine and advanced clinical testing, anatomic pathology testing, and other diagnostic information services. It also provides services under the Quest Diagnostics brand, as well as under the AmeriPath, Dermpath Diagnostics, ExamOne, and Quanum brands to physicians, hospitals, patients and consumers, health plans, government agencies, employers, retailers, pharmaceutical companies and insurers commercial clinical laboratories, and accountable care organizations through a network of laboratories, patient service centers, phlebotomists in physician offices, call centers and mobile phlebotomists, nurses, and other health and wellness professionals. In addition, the company offers risk assessment services for the life insurance industry; healthcare IT healthcare providers and payers; testing and medical director services at hospital laboratories; test offerings in cardiometabolic and endocrine; cancer; clinical drug monitoring and toxicology; infectious disease, including autoimmune; neurology diagnostics, including Alzheimer's disease; and women's health, such as prenatal genetic; workplace drug testing, testing urine, hair, and oral fluid specimens services; and employer population health services, including biometric screenings, flu shots, and related preventative services. Further, it provides population health solutions; extended care services; develops in vitro diagnostic tests; laboratory diagnostic information and digital health connectivity systems; underwriting support services, including data gathering, paramedical examinations, and clinical laboratory testing and analytics; and national specimen collection and health data solutions. Quest Diagnostics Incorporated was founded in 1967 and is headquartered in Secaucus, New Jersey.",49.36711208320655,51.84483806758728,50.60597507539691,10.8357285599946,11.492362177846047,13.034763651581457,14.00425769378445,9.96543209876543,9.75062014177724,10.207047162851367,11.617407022907289,10.304331641285955,False,False,22.608002,17.230852,,3.034887,1.9841979,0.08888630954514601,0.13835425383542538,0.06206720043321521,0.3321250566379701,0.14100589034888988,0.08989578613502493,0.03743568077946513,,0.015952753970668088,,0.9184100418410042,5.617328519855596,3.343943536882044,-0.06241858567975805,0.06690258402636409,197.82000732421875,0.0403,16.0,1.73,0.003945573812444274,-0.0034846489610362574,0.9293855711572335,0.9256835656159916,0.06756478156403434,0.04775713638423199,-0.23784277796861486,0.654
LH,Labcorp Holdings Inc.,Health Care,22653255680.0,"Labcorp Holdings Inc. provides laboratory services. It operates through two segments, Diagnostics Laboratories and Biopharma Laboratory Services. The company offers various tests, such as blood chemistry analyses, urinalyses, blood cell counts, thyroid tests, PAP tests, hemoglobin A1C, PSA, tests for sexually transmitted diseases, vitamin D testing, microbiology cultures and procedures, and alcohol and other substance abuse tests. It also provides specialty testing services comprising gene-based and esoteric testing; advanced tests target specific diseases; services related to anatomic pathology/oncology, cardiovascular disease, coagulation, diagnostic genetics, endocrinology, infectious disease, women's health, pharmacogenetics, parentage and donor testing, occupational testing services, medical drug monitoring services, chronic disease programs, and kidney stone prevention tests; and health and wellness services to employers and managed care organizations. In addition, the company offers digital pathology solutions, a pathology platforms that support the digitization, centralized review, and sharing of pathology slides; provider and payer digital platforms, an online applications for providers, MCOs, and ACOs; online and mobile applications that enable patients to check offerings, schedule PSC visits, check-in upon PSC arrival, complete documentation, access tests and test results, and manage their accounts; and Generative AI-enabled Test Selection, a generative AI-enabled tool. It serves clients, third party, medicare/medicaid, patients, pharmaceutical, biotechnology, medical device, diagnostic companies, and CROs. The company was founded in 1995 and is headquartered in Burlington, North Carolina.",33.82372925196518,47.01781924017204,40.42077424606861,6.301296605273805,10.496511776753712,10.614707695653678,6.411213174283985,11.469135802469134,10.34061821719931,10.377131737359264,8.729868606843045,6.101064876301288,False,False,26.09933,14.167983,,2.6058514,1.6236914,0.0822251381553638,0.10168449383976426,0.053237380844323744,0.28759936065139013,0.10867492850333652,0.06282388526129433,0.05552020379451106,0.05552020379451106,-0.11837788875203903,-0.11837788875203903,0.7570941321144342,6.765729585006693,3.1263898282173033,-0.052484146313589344,0.016181391482923607,273.260009765625,0.047399998,17.0,1.05,0.027300550978525667,-0.039016808615148973,0.5707816824101164,0.9263706293140835,-0.05134708382762976,0.031143158181440256,-0.45715146710662685,0.985
VTRS,Viatris Inc.,Health Care,15847768064.0,"Viatris Inc., together with its subsidiaries, operates as a healthcare company in North America, Europe, China, Taiwan, Hong Kong, Japan, Australia, New Zealand, rest of Asia, Africa, Latin America, and the Middle East. It operates in four segments: Developed Markets, Greater China, JANZ, and Emerging Markets. The company offers prescription brand drugs, generic drugs, complex generic drugs, and biosimilars. It also provides drugs in various therapeutic areas covering various noncommunicable and infectious diseases, including cardiovascular, CNS and anesthesia, dermatology, diabetes and metabolism, eye care, gastroenterology, immunology, oncology, and respiratory and allergy, as well as support services, such as diagnostic clinics, educational seminars, and digital tools to help patients better manage their health. In addition, the company offers medicines in the form of oral solid doses, injectables, and complex dosage forms to retail and pharmacy establishments, wholesalers and distributors, payers, insurers and governments, and institutions. It distributes its products through pharmaceutical wholesalers/distributors, pharmaceutical retailers, institutional pharmacies, mail-order and e-commerce pharmacies, and specialty pharmacies under the Lyrica, Lipitor, Celebrex, Viagra, Creon, Influvac, Wixela Inhub, EpiPen Auto-Injector, Fraxiparine, Yupelri, Norvasc, Amitiza, Effexor, Lipacreon, Zoloft, Xalabrands, Dymista, Xanax, and Breyna brands. The company has collaboration agreements with Mapi Pharma Ltd. to develop and commercialize long-acting glatiramer acetate depot products and additional products; Revance Therapeutics, Inc. to develop, manufacture, and commercialize a biosimilar to the branded biologic product, BOTOX; and Theravance Biopharma, Inc. to develop and commercialize revefenacin. Viatris Inc. was founded in 1961 and is headquartered in Canonsburg, Pennsylvania.",22.003756588795913,44.392701756831535,33.198229172813726,3.931312814351225,6.199143411845024,8.776808363875183,3.096491998724481,10.0,12.04113785324024,11.600639387556534,4.201927658408469,6.5489968576263,False,False,,5.1019835,,1.0650285,1.1082432,0.007130192367260182,-0.23892517996370138,0.1167861614661248,0.3505968573206806,0.017727396695081783,-0.2457989216707809,-0.04196777704087673,-0.04196777704087673,,,0.9990959330582614,0.5378739656269892,0.5963940729587935,-0.0806212606058482,0.17162894168143455,13.609999656677246,0.028099999,9.0,3.53,0.041522695636487465,-0.08408226590706916,0.0,0.9435699331868183,-0.11288544714453419,0.10007062986454451,,0.822
OGN,Organon & Co.,Health Care,1798781056.0,"Organon & Co. develops and delivers women health solutions through prescription therapies and medical devices in the United States, Europe, Canada, Japan, rest of the Asia Pacific, China, Latin America, the Middle East, Russia, Africa, and internationally. The company's women's health portfolio comprises contraception and fertility brands, such as Nexplanon, a long-acting reversible contraceptive; NuvaRing, a monthly vaginal contraceptive ring; Cerazette, Marvelon, and Mercilon, which are daily pills used to prevent pregnancy; Follistim AQ, which is used to promote the development of multiple ovarian follicles in medically assisted reproduction procedures; Elonva, a follicle stimulant; Ganirelix acetate injection, an injectable antagonist; Jada for abnormal postpartum uterine bleeding and hemorrhage; and Xaciato for bacterial vaginosis. Its biosimilars portfolio consists of immunology products, such as Brenzys, Renflexis, and Hadlima; oncology products, including Ontruzant and Aybintio; Bildyos and Bilprevda, a recombinant anti-RANKL human monoclonal antibodies; and Poherdy, a neu receptor antagonist. The company also offers cholesterol-modifying medicines under the Zetia, Ezetrol, Vytorin, Inegy, Atozet, Rosuzet, and Zocor brands; Cozaar and Hyzaar for hypertension; respiratory products used to control and prevent asthma-induced symptoms under the Singulair, Dulera, Zenhale, and Asmanex brands, as well as seasonal allergic rhinitis under the Nasonex, Clarinex, and Aerius brands. In addition, it provides dermatology products under the Vtama, Diprosone, and Elocon brand; bone health products under the Fosamax brand; and non-opioid pain management products under the Arcoxia, Diprospan, and Celestone brands, as well as Proscar for symptomatic benign prostatic hyperplasia; and Propecia for male pattern hair loss. The company serves drug wholesalers and retailers, hospitals, clinics, government agencies, health maintenance organizations, pharmacy benefit managers, and other institutions. Organon & Co. was founded in 1923 and is headquartered in Jersey City, New Jersey.",38.21414619770839,69.58431035186064,53.89922827478451,11.104729948832958,3.7372258491210104,15.442060830502225,7.930129569252194,16.412345679012343,17.742806889988987,17.057122542153603,8.412035240705706,9.96,False,False,8.129412,1.8541476,,2.3918312,0.28937918,0.06114713216957605,0.24867021276595744,0.2134778986687305,0.532979407979408,0.19723294723294724,0.030083655083655084,0.002262451150677469,,-0.41139480574955434,,11.49468085106383,2.4325396825396823,1.1140872614525756,-0.3496488827770129,-0.13446361252730984,6.909999847412109,0.098900005,7.0,1.37,0.03432769795849269,-0.078925135047584,0.492300090289452,0.9841088304881881,,0.10971685971685971,-0.7719210688300704,0.638
DVA,DaVita Inc.,Health Care,10072806400.0,"DaVita Inc. provides kidney dialysis services for patients suffering from chronic kidney failure in the United States. The company operates kidney dialysis centers and provides related lab services in outpatient dialysis centers. It also offers outpatient, hospital inpatient, and home-based hemodialysis dialysis services; operates clinical laboratories that provide routine laboratory tests for dialysis and other physician-prescribed laboratory tests for ESRD patients; and management and administrative services to outpatient dialysis centers. In addition, the company offers integrated care and disease management services to patients in risk-based and other integrated care arrangements; clinical research programs; physician services; and comprehensive kidney care services. Further, it engages in the transplant software business. The company was formerly known as DaVita HealthCare Partners Inc. and changed its name to DaVita Inc. in September 2016. DaVita Inc. was incorporated in 1994 and is headquartered in Denver, Colorado.",43.863906542646255,64.31182386923992,54.08786520594309,8.372788842465834,10.008453874381294,12.535972039227214,12.946691786571915,13.85432098765432,19.57700984742374,11.38493162402301,10.678894743472176,8.816666666666666,False,False,15.827729,9.188572,,-15.864391,0.7383094,0.13623224428468622,-1.1470183479193097,0.13011627027796344,0.32247824884562265,0.14737263294644334,0.054738636885879564,0.055264367135682946,,0.10044745178655523,,-19.77374739280152,3.4670199301290165,1.5511248130879758,-0.03595655960489988,0.13011126583932522,150.67999267578125,0.1917,7.0,0.0,0.017758752435512008,0.03431888758063725,0.7873436705993608,0.9299850255065412,,0.042209271242416205,-0.419463651418343,0.915
CAH,"Cardinal Health, Inc.",Health Care,50781196288.0,"Cardinal Health, Inc. operates as a healthcare services and products company in the United States and internationally. It operates in two segments: Pharmaceutical and Specialty Solutions, and Global Medical Products and Distribution. The company provides customized solutions for hospitals, healthcare systems, pharmacies, ambulatory surgery centers, clinical laboratories, physician offices, and patients in the home. It distributes branded and generic pharmaceutical, specialty pharmaceutical, and over-the-counter healthcare and consumer products. The company also provides services to pharmaceutical manufacturers and healthcare providers for specialty pharmaceutical products; pharmacy management services to hospitals; operates pharmacies, including pharmacies in community health centers; and repackages generic pharmaceuticals and over-the-counter healthcare products. In addition, it manufactures, sources, and distributes Cardinal Health branded medical, surgical, and laboratory products and devices that include exam and surgical gloves; needles, syringe, and sharps disposals; compression, incontinence, nutritional delivery, and wound care products; single-use surgical drapes, gowns, and apparel products; fluid suction and collection systems; urology products; operating room supply products; and electrode product lines. Further, the company distributes a range of national brand products, including medical, surgical, and laboratory products; provides supply chain services and solutions to hospitals, ambulatory surgery centers, clinical laboratories, and other healthcare providers; and assembles and sells sterile and non-sterile procedure kits. Additionally, it manufactures, prepares, and delivers radiopharmaceuticals; and optimizes direct shipments through integrated technology solutions. The company was incorporated in 1979 and is headquartered in Dublin, Ohio.",40.650125115041966,51.883364059503464,46.26674458727271,5.629504846053913,10.809145118620926,11.808936803465143,12.402538346901986,10.0,11.673137168945866,9.47971174099458,11.123848482896346,9.606666666666667,False,False,31.050362,18.644644,,-17.659575,0.2075472,0.9263034086332516,-0.5613088816972313,0.03643080776411661,0.03669724770642202,0.010432297891076386,0.007013271751925168,0.07071540578204716,,,,-3.06616325062927,10.8,4.843897598794828,-0.05630538280180234,0.11768703562703493,215.8000030517578,0.0296,15.0,0.95,0.0007335470557258306,0.0013436950431670956,0.0,0.9009730000011301,,0.0024575654377341875,-0.39953537417695806,0.65
