ticker,company,sector,market_cap,description,combs_score,weschler_score,combined_score,combs_unit_economics,combs_frictionless,combs_capital_allocation,combs_moat,weschler_variant,weschler_complexity,weschler_distressed,weschler_quality,weschler_compounding,combs_style_flag,weschler_style_flag,trailing_pe,forward_pe,peg_ratio,price_to_book,price_to_sales,roic,roe,fcf_yield,gross_margin,operating_margin,net_margin,revenue_cagr_3y,revenue_cagr_5y,earnings_cagr_3y,earnings_cagr_5y,debt_to_equity,interest_coverage,altman_z,drawdown_52w,price_vs_200ma,current_price,short_percent,analyst_count,dividend_yield,margin_stability,margin_trend,earnings_consistency,revenue_stability,book_value_growth,reinvestment_rate,pe_gap,beta
DPZ,"Domino's Pizza, Inc.",Consumer Discretionary,12553666560.0,"Domino's Pizza, Inc. operates as a pizza company worldwide. The company operates through three segments: U.S. Stores, International Franchise, and Supply Chain. It offers pizzas under the Domino's brand name through company-owned and franchised stores. The company also provides bread products, wings, boneless chicken, pastas, oven-baked sandwiches, soft drink products and desserts. In addition, it offers parmesan stuffed crust pizza; spicy chicken bacon ranch specialty pizza; and garlic, and cinnamon bread bites, as well as croissant, chocolate volcano, and chicken burst pizzas. Domino's Pizza, Inc. was founded in 1960 and is based in Ann Arbor, Michigan.",54.285762059318316,60.34690973828126,57.31633589879979,12.920747455419225,9.231337472264892,14.235102002943488,17.89857512869071,9.291358024691355,9.659098442161087,15.566232211019278,15.460221060409543,10.37,False,True,21.234356,17.365011,,-3.2178535,2.5412312,0.726400533708083,-0.15423791289832567,0.05349066719197614,0.3995065581051313,0.1922969946927061,0.12180257708815032,0.02876024391390608,,0.0998427924870453,,-1.294052869646888,4.8473557446982225,3.143277672604545,-0.1988014535980823,-0.08920679629288372,373.29998779296875,0.0917,31.0,2.12,0.012011820652233295,0.0277111460182716,0.8738305737988236,0.9557040196476402,,0.024404483082368117,-0.18222097246556473,1.185
BBY,"Best Buy Co., Inc.",Consumer Discretionary,13521300480.0,"Best Buy Co., Inc. offers technology products and solutions in the United States, Canada, and internationally. The company provides computing and mobile phone products, such as desktops, notebooks, and peripherals; mobile phones comprising related mobile network carrier commissions; networking products; tablets covering e-readers; smartwatches; and consumer electronics consisting of digital imaging, health and fitness products, portable audio comprising headphones and portable speakers, and smart home products, as well as home theaters that includes home theater accessories, soundbars, and televisions. It also offers appliances, such as dishwashers, laundry, ovens, refrigerators, blenders, coffee makers, vacuums, and personal care; entertainment products consisting of drones, peripherals, gaming, toys, and virtual reality, as well as hardware and software, and augmented reality glasses and other software products; and other products, such as baby, food and beverage, luggage, and outdoor living products. In addition, the company provides delivery, installation, marketplace commissions, memberships, repair, set-up, technical support, health-related, and warranty-related services. It offers its products through stores and websites under the Best Buy, Best Buy Ads, Best Buy Business, Best Buy Essentials, Best Buy Health, Best Buy Marketplace, Geek Squad, Imagine That, Insignia, Lively, Jitterbug, My Best Buy, My Best Buy Memberships, Pacific Kitchen, Home, TechLiquidators, and Yardbird brand names, as well as domain names comprising bestbuy.com, lively.com, techliquidators.com, yardbird.com, bestbuy.ca, and techliquidators.ca. The company was formerly known as Sound of Music, Inc. Best Buy Co., Inc. was incorporated in 1966 and is headquartered in Richfield, Minnesota.",49.034068726915045,58.01955431019936,53.5268115185572,7.442752469205925,9.242431515617,18.612721840157363,13.736162901934753,12.627160493827159,9.39904519550504,13.762229088926192,15.836828765956824,6.394290765984144,False,False,12.778217,9.1465225,,4.552381,0.3243218,0.24817132719726487,0.3606612685560054,0.09303838797612461,0.22482070470845025,0.04197548631599146,0.02564102564102564,-0.0343345487205291,-0.0343345487205291,-0.0900900029576508,-0.0900900029576508,1.3943994601889338,37.234042553191486,4.177932142681798,-0.19189610349904507,-0.051898485044242215,64.52999877929688,0.1423,20.0,5.96,0.0010779497645438305,2.9829916146972835e-05,0.8169827500330596,0.9487631032990933,0.0197619322258078,0.01688613849511885,-0.2842098001622605,1.374
ULTA,"Ulta Beauty, Inc.",Consumer Discretionary,23635720192.0,"Ulta Beauty, Inc. operates as a specialty beauty retailer in the United States, Mexico, and Kuwait. The company offers branded and private label beauty products, including cosmetics, fragrance, haircare, skincare, bath and body products, professional hair products, and salon styling tools through its Ulta Beauty stores, shop-in-shops, Ulta.com website, and its mobile applications. It also provides wellness products. The company was formerly known as ULTA Salon, Cosmetics & Fragrance, Inc. and changed its name to Ulta Beauty, Inc. in January 2017. Ulta Beauty, Inc. was incorporated in 1990 and is based in Bolingbrook, Illinois.",54.21559726007209,52.358256384637215,53.28692682235465,9.695522511634152,15.991743471582181,17.525007444833737,11.003323832022023,9.516049382716048,6.431618676959594,11.783741593336682,14.55383488729325,10.07301184433164,False,False,20.787748,16.902523,,8.393698,1.9072108,0.2566489097382314,0.41144967399109167,0.04518377232953833,0.39097025535753765,0.12497663969943887,0.09307639423472623,0.06676379680111233,,-0.024452356138569442,,0.7783481858609264,,6.385803941316773,-0.22196586526844675,-0.04958387023736771,532.7899780273438,0.0572,24.0,0.0,0.015597539972108962,-0.03657481995508702,0.9520285142502141,0.9208152970549279,0.1267466086713429,0.03508717144281931,-0.18689975460545327,0.953
AZO,"AutoZone, Inc.",Consumer Discretionary,58785779712.0,"AutoZone, Inc. operates as a retailer and distributor of automotive replacement parts and accessories in the United States, Mexico, and Brazil. The company offers a product line for cars, sport utility vehicles, vans, and light duty trucks, including new and remanufactured automotive hard parts, maintenance items, accessories, and non-automotive products. It also provides A/C compressors, batteries and accessories, bearings, belts and hoses, calipers, chassis, clutches, CV axles, engines, fuel pumps, fuses, ignition and lighting products, mufflers, radiators, starters and alternators, thermostats, and water pumps, as well as tire repairs. In addition, the company provides maintenance products, such as antifreeze and windshield washer fluids; brake drums, rotors, shoes, and pads; brake and power steering fluids, and oil and fuel additives; oil and transmission fluids; oil, cabin, air, fuel, and transmission filters; oxygen sensors; paints and accessories; refrigerants and accessories; shock absorbers and struts; spark plugs and wires; and windshield wipers. Further, it offers air fresheners, cell phone accessories, drinks and snacks, floor mats and seat covers, interior and exterior accessories, mirrors, performance products, protectants and cleaners, sealants and adhesives, steering wheel covers, tools, vehicle entertainment systems, and wash and wax products, as well as towing services. Additionally, the company provides a sales program that offers commercial credit and delivery of parts and other products; sells automotive diagnostic, repair, collision, and shop management information software under the ALLDATA brand through alldata.com; Duralast branded products through duralastparts.com; and automotive hard parts, maintenance items, accessories, and non-automotive products through autozone.com. AutoZone, Inc. was founded in 1979 and is headquartered in Memphis, Tennessee.",56.893638897273036,58.57587705350679,57.73475797538991,15.689656208607824,12.019702594299368,12.129035826064436,17.05524426830141,8.340740740740738,12.239102077474953,13.555326269419528,15.624041299204897,8.816666666666666,False,False,24.85423,20.309702,,-20.150324,2.9977767,0.33448956850877476,-0.7316982947960542,0.030450901710751474,0.5262486365892685,0.1906230501253068,0.13191215645706095,0.05231525172845841,,0.009330259611037173,,-3.5992001904922013,7.416157897764156,2.784305085140244,-0.17296241059490494,-0.05791721601129744,3548.18994140625,0.0222,23.0,0.0,0.006056878409293867,-0.010624963224245831,0.9613847200190443,0.9327974828872081,,0.07008167448724219,-0.18284726583764613,0.406
KMX,"CarMax, Inc.",Consumer Discretionary,6655016960.0,"CarMax, Inc., through its subsidiaries, operates as a retailer of used vehicles and related products in the United States. The company operates in two segments: CarMax Sales Operations and CarMax Auto Finance. The CarMax Sales Operations segment offers customers a range of makes and models of used vehicles, including domestic, imported, and luxury vehicles, as well as hybrid and electric vehicles; used vehicle auctions; extended protection plans to customers at the time of sale; and reconditioning and vehicle repair services. The CarMax Auto Finance segment provides financing alternatives for retail customers across a range of credit spectrum and arrangements with various financial institutions. The company was founded in 1993 and is based in Richmond, Virginia.",26.786436257169505,49.626581228890096,38.2065087430298,4.515395641298818,9.135277991124765,4.20354569549165,8.932216929254276,10.380246913580248,18.343799116832574,13.047911298341655,3.999453513952291,3.855170386183333,False,False,14.859016,17.199242,,1.0690949,0.23909502,-0.00653928360415627,0.08017891432756238,0.023516093338400747,0.10996299531521905,-0.008367794388735883,0.018993967386396148,-0.06168880669385879,-0.06168880669385879,-0.24243174782221721,-0.24243174782221721,3.0789706787839415,-0.25313927366522754,1.6802103578356165,-0.3256955763700587,-0.007555021964812215,45.31999969482422,0.1373,12.0,0.0,0.01312981056285407,-0.025658668249549967,0.49280154156843803,0.9067291275459636,0.06042461152504175,0.017756291213815893,0.1574953550087032,1.299
GPC,Genuine Parts Company,Consumer Discretionary,15103095808.0,"Genuine Parts Company distributes automotive and industrial replacement parts. The company operates in three segments: North America Automotive Parts Group, International Automotive Parts Group, and Industrial Parts Group. It distributes automotive replacement parts, accessories, tools, equipment, and related solutions for hybrid and electric vehicles, trucks, buses, motorcycles, farm equipment, and heavy-duty equipment. The company also offers replacement parts, including brakes, batteries, filters, engine components, and fluids; specialized services, such as paint mixing, hydraulic hose assembly, battery testing, and key cutting; and accessories and specialty equipment for automotive and heavy-duty vehicles, as well as tools and diagnostic devices for repair and maintenance. In addition, it provides independent repair shops and auto care centers under the NAPA brand, and offers technical expertise and training programs to customers. Further, the company provides bearings, seals, and gaskets; hose, fittings, hydraulics, and pneumatics components; abrasives, adhesives, sealants, and tape; pumps and power transmission; tools and testing equipment; electrical supplies and safety products; and chemicals and janitorial supplies. Additionally, it offers inventory management; vendor-managed inventory; asset repair and tracking, including radio frequency identification; and specialized repair services for gearboxes, fluid power systems, pumps, drive shafts, electrical panels, and hoses and gaskets. The company was incorporated in 1928 and is headquartered in Atlanta, Georgia.",37.85394193813125,59.61923790841048,48.73658992327087,7.546871024389626,10.832986644478579,8.936755829755814,10.537328439507233,9.930864197530864,15.259900884236636,12.31926074823313,11.17892443035571,10.930287648054144,False,False,230.97871,12.754494,,3.3777225,0.62152296,0.14649096268195877,0.014909593982895285,0.027870047661158293,0.3679278239578939,0.04998374289268527,0.0027137702616622677,0.03220324726356383,,-0.6179657473735348,,1.4775587379671358,7.428546964637383,2.1092354880746687,-0.2117820098185631,-0.12487236649820618,108.55999755859375,0.0357,7.0,3.96,0.011786442788581177,-0.023070247533534025,0.3529546220177995,0.9606018083736665,0.05279807914266721,0.01933478492984876,-0.9447806509959294,0.772
ETSY,"Etsy, Inc.",Consumer Discretionary,5272875008.0,"Etsy, Inc., together with its subsidiaries, operates two-sided online marketplaces that connect buyers and sellers in the United States, the United Kingdom, and internationally. It operates through Etsy and Depop segments. The company operates Etsy marketplace that connects artisans with various consumers; and Depop, a fashion resale marketplace. It also provides marketplace activities, including transaction offsite advertising, payments processing, and listing fees, as well as from optional seller services, which include on-site advertising and shipping labels. The company was formerly known as Indieco, Inc changed its name to Etsy, Inc. in June 2006. Etsy, Inc. was founded in 2005 and is headquartered in Brooklyn, New York.",53.83341208444256,63.822991276893305,58.82820168066793,13.59672932404237,9.726195809865164,17.5153856574456,12.995101293089423,10.777777777777775,14.642616570615974,16.45587905096924,13.130051210863659,8.816666666666666,False,False,38.9927,9.020951,,-4.720332,1.8286364,0.4178416619613448,-0.14842249532144305,0.12113884721919052,0.7163864344073403,0.12759246485435588,0.05652226234705658,0.03963658980651208,,,,-2.8009598440936347,19.87751904478902,1.1985036252932018,-0.19536076728335403,-0.04704142994537441,53.41999816894531,0.2149,26.0,0.0,0.011091713468015789,-0.02300974993682034,0.0,0.9507769430619611,,0.17508438526638279,-0.7686502601769049,1.768
DECK,Deckers Outdoor Corporation,Consumer Discretionary,15998409728.0,"Deckers Outdoor Corporation, together with its subsidiaries, designs, markets, and distributes footwear, apparel, and accessories for casual lifestyle use and high-performance activities in the United States and internationally. The company offers premium footwear, apparel, and accessories under the UGG brand name; footwear, such as running, trail, hiking, fitness, and lifestyle shoes, as well as apparel and accessories under the HOKA brand name; and sandals, shoes, and boots under the Teva brand name. It also provides a casual footwear fashion line under the Koolaburra brand name; and footwear products under the AHNU brand name. The company sells its products through domestic and international retailers, international distributors, and directly to its consumers through its direct-to-consumer business, which includes e-commerce websites and retail stores. Deckers Outdoor Corporation was founded in 1973 and is headquartered in Goleta, California.",65.48983473881331,54.49304804303842,59.99144139092587,15.480361092858882,14.038845152756444,19.29511942465188,16.675509068546102,9.032098765432098,6.935253990826179,9.96463053449806,12.63646773387055,15.924597018411541,True,False,15.592329,14.990822,,5.987237,2.9766104,1.017095580420913,0.3844353371828956,0.059902953874391485,0.57879814955516,0.23649894937672647,0.19377580926875176,0.16534288549837894,0.16534288549837894,0.2881789620084054,0.2881789620084054,0.11021630210428676,335.25504691498435,13.235788836244236,-0.08242080445312265,0.0485842977635752,109.7699966430664,0.039100002,21.0,0.0,0.02825170954507521,0.05724617689732028,0.6501073745469608,0.8009249786756636,0.17761094642410558,0.017283936254967294,-0.038577110577900184,1.211
LULU,lululemon athletica inc.,Consumer Discretionary,19533473792.0,"lululemon athletica inc., together with its subsidiaries, designs, distributes, and retails technical athletic apparel, footwear, and accessories for women and men under the lululemon brand in the United States, Canada, Mexico, China Mainland, Hong Kong, Taiwan, Macau, and internationally. It offers pants, shorts, tops, and jackets for athletic activities, such as yoga, running, training, and other activities. The company also provides fitness-inspired accessories. It sells its products through company-operated stores; seasonal stores, pop-ups, university campus retailers, and yoga and fitness studios; outlets; Like New, a re-commerce program; and its e-commerce website. The company was founded in 1998 and is based in Vancouver, Canada.",59.829719189909795,52.662323362001835,56.24602127595581,15.069204826007276,12.312948028673837,18.276043262010013,14.171523073218664,9.602469135802469,7.176061458188543,14.19714627861473,11.22023362983603,10.466412859560068,False,False,11.979136,12.5511055,,3.9094195,1.7593603,0.3147912305181752,0.3182656030827274,0.047184387672891806,0.566005440167168,0.19910786662583538,0.14223542233350747,0.11034694078962404,,0.22703226358985762,,0.3624544523805685,,6.614714159614486,-0.47418452191137345,-0.08634985934723016,166.50999450683594,0.056399997,25.0,0.0,0.016868225190040737,-0.01371960012782944,0.7144937357578961,0.8665015599316364,0.16367741551634074,0.061319150469259454,0.047747141363116655,1.07
HAS,"Hasbro, Inc.",Consumer Discretionary,13092216832.0,"Hasbro, Inc. operates as a toy and game company in the United States, Europe, Canada, Mexico, Latin America, Australia, China, and Hong Kong. The company offers trading cards and collectibles, action figures, arts and crafts and creative play products, dolls, play sets, preschool toys, plush products, vehicles and toy-related specialty products, sports action products and accessories, and other consumer products; and licensed products, such as apparel, publishing products, home goods and electronics, and toy products. It also engages in the sourcing, marketing, and sale of toy and game products; and promotes its brands through the out-licensing of trademarks, characters, and other brand and intellectual property rights to third parties through the sale of branded consumer products, such as toys and apparel. In addition, the company is involved in the promotion of its brands through the development of trading cards, role-playing, and digital game experiences based on Hasbro and Wizards of the Coast games; and license certain brands to other third-party digital game developers who transform Hasbro brand-based characters and other intellectual properties, into digital gaming experiences. Further, it develops and produces of Hasbro-branded entertainment content, including film, television, children's programming, digital content, and live entertainment. The company sells its products to retailers, distributors, wholesalers, discount stores, specialty hobby stores, drug stores, mail order houses, catalog stores, department stores, and other traditional retailers, as well as ecommerce retailers under the MAGIC: THE GATHERING, MONOPOLY, HASBRO GAMES, PLAY-DOH, TRANSFORMERS, DUNGEONS & DRAGONS, NERF, and PEPPA PIG, as well as LUCASFILMS' STAR WARS, BEYBLADE, Final Fantasy, The Lord of the Rings, Fallout, SPIDER-MAN, and THE AVENGERS brands. Hasbro, Inc. was founded in 1923 and is headquartered in Pawtucket, Rhode Island.",51.03175934640272,42.24653103610906,46.63914519125589,11.391095364647617,10.324767451783579,14.28910901443428,15.026787515537245,10.0,8.300020314989256,7.206544634169813,8.342537998963532,8.397428087986464,False,False,,14.868071,,24.259645,2.7848077,0.2733403100268167,-0.5987000928505106,0.053077336628089236,0.645821368557633,0.22504413672813903,-0.06857677663624955,-0.07063068574893083,,,,6.119777158774373,6.4749082007343945,3.0044944542179737,-0.05912637527123986,0.10891803451870535,93.05999755859375,0.0497,15.0,2.98,0.08707848558473837,0.15165810022293985,0.0,0.8541436455702278,-0.4250148903228492,0.1241996894475996,,0.544
EXPE,"Expedia Group, Inc.",Consumer Discretionary,28214878208.0,"Expedia Group, Inc. operates as an online travel company in the United States and internationally. The company operates through B2C, B2B, and trivago segments. The B2C segment includes Brand Expedia, a full-service online travel brand offers various travel products and services; Hotels.com for lodging accommodations; Vrbo, an online marketplace for the alternative accommodations; and Orbitz, Travelocity, ebookers, and Wotif Group. The B2B segment provides various travel and non-travel companies including airlines, offline travel agents, online retailers, corporate travel management, and financial institutions who leverage its travel technology and tap into its diverse supply to augment their offerings and market Expedia Group rates and availabilities to its travelers. The trivago segment sends referrals to online travel companies and travel service providers from hotel metasearch websites. In addition, it provides brand advertising through online and offline channels, loyalty programs, mobile apps, and search engine marketing, as well as metasearch, social media, direct and personalized traveler communications on its websites, and through direct e-mail communication with its travelers. The company was formerly known as Expedia, Inc. and changed its name to Expedia Group, Inc. in March 2018. Expedia Group, Inc. was founded in 1996 and is headquartered in Seattle, Washington.",67.27457648495579,52.501630501103904,59.888103493029845,14.173733502752443,14.487807219662061,22.953662653855385,15.659373108685893,12.834567901234566,8.742694622943109,12.037866070760314,11.78614657621667,7.100355329949238,True,False,24.161594,10.029825,,21.96718,1.9150803,0.773726390737927,1.0077881619937694,0.11022553338962121,0.9011742347111925,0.14681327631846874,0.08783004140365167,0.08087962506974211,,0.5433480265398722,,4.996105919003115,7.234113712374582,1.508757357608772,-0.18548746384293896,8.523409078123406e-05,230.25999450683594,0.0664,34.0,0.71,0.01847893678377412,0.04490190235772476,0.5232387667690364,0.9017826674326679,-0.1745583650280481,0.13893979501798684,-0.5848856246818815,1.332
LKQ,LKQ Corporation,Consumer Discretionary,7669033984.0,"LKQ Corporation engages in the distribution of replacement parts, components, and systems used in the repair and maintenance of vehicles and specialty vehicle aftermarket products and accessories. The company operates through four segments: Wholesale-North America, Europe, Specialty, and Self Service. It offers bumper covers, automotive body panels, and lights, as well as paint and paint related consumables for refinishing vehicles; mechanical automotive parts and accessories; salvage products, including mechanical and collision parts comprising engines; transmissions; door assemblies; sheet metal products, such as trunk lids, fenders, and hoods; and lights and bumper assemblies. The company also provides scrap metal and other materials to metals recyclers; precious metals, such as catalytic converters; and brake pads, discs and sensors, clutches, steering and suspension products, filters, and oil and automotive fluids, as well as electrical products, including spark plugs and batteries. In addition, the company distributes recreational vehicle appliances and air conditioners, towing hitches, truck bed covers, vehicle protection products, marine electronics, cargo management products, wheels, tires, and suspension products. It serves collision and mechanical repair shops, new and used car dealerships, and retail customers. The company operates in the United States, Canada, Germany, the United Kingdom, Belgium, the Netherlands, Luxembourg, Italy, the Czech Republic, Austria, Poland, Slovakia, France, and other European countries. LKQ Corporation was incorporated in 1998 and is headquartered in Antioch, Tennessee.",35.660498950785566,68.12848153723436,51.894490244009965,8.258059631224421,6.490042029356545,10.806605720340679,10.105791569863923,12.97283950617284,18.11210131833588,15.862831054134098,9.963924548608462,11.216785109983078,False,False,13.008658,9.041291,,1.1722255,0.56179285,0.07179847504211366,0.09285605017592168,0.11044415786487666,0.3856860303274485,0.07962786609039631,0.0444656069152443,0.02184739022420734,,-0.1916063611213119,,0.7742083524552547,4.852678571428571,2.564993072979819,-0.22979645221061465,-0.014829957418311333,30.049999237060547,0.0638,8.0,4.07,0.014448334069287038,-0.03308121629197043,0.7091945771725974,0.9658884374064753,0.06230117641829125,0.015823016628818402,-0.30497896093509425,0.902
