ticker,company,sector,market_cap,description,combs_score,weschler_score,combined_score,combs_unit_economics,combs_frictionless,combs_capital_allocation,combs_moat,weschler_variant,weschler_complexity,weschler_distressed,weschler_quality,weschler_compounding,combs_style_flag,weschler_style_flag,trailing_pe,forward_pe,peg_ratio,price_to_book,price_to_sales,roic,roe,fcf_yield,gross_margin,operating_margin,net_margin,revenue_cagr_3y,revenue_cagr_5y,earnings_cagr_3y,earnings_cagr_5y,debt_to_equity,interest_coverage,altman_z,drawdown_52w,price_vs_200ma,current_price,short_percent,analyst_count,dividend_yield,margin_stability,margin_trend,earnings_consistency,revenue_stability,book_value_growth,reinvestment_rate,pe_gap,beta
AAL,American Airlines Group Inc.,Industrials,7507662848.0,"American Airlines Group Inc., through its subsidiaries, operates as a network air carrier in the United States, Latin America, Atlantic, and Pacific. The company provides scheduled air transportation services for passengers and cargo through its hubs in Charlotte, Chicago, Dallas/Fort Worth, Los Angeles, Miami, New York, Philadelphia, Phoenix, and Washington, D.C., as well as through partner gateways in London, Doha, Madrid, Seattle/Tacoma, Sydney, and Tokyo. It also operates a mainline fleet of 1,013 aircraft. The company was formerly known as AMR Corporation and changed its name to American Airlines Group Inc. in December 2013. American Airlines Group Inc. was founded in 1926 and is headquartered in Fort Worth, Texas.",22.315755136229196,46.41737205841619,34.366563597322696,4.137793812856312,7.126909455538488,3.2042377356099836,7.846814132224413,10.414814814814815,10.617174719599689,12.903386187945728,5.283949252053813,7.198047084002139,False,False,66.882355,4.7082887,,-2.0145288,0.13741992,0.029498068993245155,-0.02978266702441642,-0.23789027772814553,0.19166071788113412,0.029762231618252706,0.002031739058810609,0.03714312343491266,0.03714312343491266,-0.04389317293530448,-0.04389317293530448,-9.896431446203382,0.9475524475524476,0.6637401912405249,-0.25831702921428557,-0.1053584107933272,11.369999885559082,0.086,24.0,0.0,0.021158389495112225,-0.006994216075280203,0.13331927647733066,0.9510544527056219,,0.06801749858144344,-0.9296034252980476,1.248
PG,The Procter & Gamble Company,Consumer Staples,343255580672.0,"The Procter & Gamble Company provides branded consumer packaged goods worldwide. It operates through Beauty; Grooming; Health Care; Fabric & Home Care; and Baby, Feminine & Family Care segments. The company offers conditioners, shampoos, styling aids, and treatments under the Head & Shoulders, Herbal Essences, Pantene, and Rejoice brands; antiperspirants, deodorants, and personal cleansing products under the Native, Old Spice, Safeguard, and Secret brands; and facial moisturizers, cleaners, and treatments under the Olay and SK-II brands. It also provides blades, razors, shave products, appliances, and other grooming products under the Braun, Gillette, and Venus brands. In addition, the company offers toothbrushes, toothpastes, and other oral care products under the Crest and Oral-B brands; and gastrointestinal, pain relief, rapid diagnostics, respiratory, vitamins/minerals/supplements, and other personal health care products under the Metamucil, Neurobion, Pepto-Bismol, and Vicks brands. Further, it provides fabric enhancers, and laundry additives and detergents under the Ariel, Downy, Gain, and Tide brands; and air and dish care, P&G professional, and surface care under the Cascade, Dawn, Fairy, Febreze, Mr. Clean, and Swiffer brands. Additionally, the company offers baby wipes, and taped diapers and pants under the Luvs and Pampers brands; adult incontinence and menstrual care products under the Always, Always Discreet, and Tampax brands; and paper towels, tissues, and toilet papers under the Bounty, Charmin, and Puffs brands. It sells its products through mass merchandisers, social and e-commerce channels, grocery and specialty beauty stores, membership club stores, drug and department stores, distributors, wholesalers, airport duty-free and high-frequency stores, pharmacies, electronics stores, and professional channels, as well as directly to consumers. The Procter & Gamble Company was founded in 1837 and is headquartered in Cincinnati, Ohio.",64.16122031692045,48.20086408731741,56.18104220211893,16.91930199905002,12.311107910906298,16.19468817845109,18.736122228513043,7.787654320987655,3.7366001261667754,10.198386562169212,17.65538673944307,8.822836338550704,False,False,21.472914,20.100931,,6.520251,4.0260334,0.2090790942715684,0.3071214335153426,0.04091411994673389,0.5116036258364577,0.24264391818138675,0.1895258886621423,0.01674893047051751,0.01674893047051751,0.027115045810250926,0.027115045810250926,0.6818234253633777,22.54796030871003,5.402491865344837,-0.122846852039663,-0.02253339128328487,146.66000366210938,0.0099,22.0,2.92,0.010686204267249004,0.020500678005298367,0.9591644691118444,0.9767432154446138,0.0373852173692617,0.044765317260690045,-0.06389365691121383,0.403
KO,The Coca-Cola Company,Consumer Staples,336498688000.0,"The Coca-Cola Company, a beverage company, manufactures and sells various nonalcoholic beverages in the United States and internationally. The company provides Trademark Coca-Cola, sparkling soft drinks and flavors; water, sports, coffee, and tea; juice, value-added dairy, and plant-based beverages; and emerging beverages. It also offers beverage concentrates and syrups, as well as fountain syrups to fountain retailers comprising restaurants and convenience stores. The company sells its products under the Coca-Cola, Diet Coke/Coca-Cola Light, Coca-Cola Zero Sugar, caffeine free Diet Coke, Cherry Coke, Fanta, Sprite, Simply, Fanta Orange, Fanta Zero Orange, Fanta Zero Sugar, Fanta Apple, Sprite Zero Sugar, Simply Orange, Simply Apple, Simply Grapefruit, Fresca, Schweppes, Thums Up, Aquarius, Ayataka, BODYARMOR, Ciel, Costa, Crystal, Dasani, Fuze Tea, Georgia, glacéau smartwater, glacéau vitaminwater, Gold Peak, I LOHAS, Powerade, Topo Chico, Core Power, Del Valle, fairlife, innocent, Maaza, Minute Maid, Minute Maid Pulpy, Santa Clara, and dogadan brands. It operates through a network of independent bottling partners, distributors, wholesalers, and retailers, as well as through bottling and distribution operators. The Coca-Cola Company was founded in 1886 and is headquartered in Atlanta, Georgia.",67.0422033731937,41.277938549410194,54.16007096130195,19.735086352095493,13.983721624850656,14.224555727622048,19.098839668625498,6.9753086419753085,3.2153656163460815,4.977803201214622,14.61996870408738,11.489492385786802,True,False,25.717106,22.637838,,10.454667,7.0190167,0.1816918206687219,0.4074419472162641,0.015738545762175454,0.6162574831563797,0.31102813875388496,0.2733985523873094,0.03689014114187783,,0.11161559025666223,,1.4141564860580063,9.015114873035067,5.060702037736174,-0.034850810399852016,0.09051814082017207,78.18000030517578,0.0126,23.0,2.67,0.013670364293922188,0.031007675541160573,0.8632831712214531,0.9531191800194104,0.10097335422391196,0.04405414989257629,-0.11973617871311035,0.361
PEP,"PepsiCo, Inc.",Consumer Staples,215279534080.0,"PepsiCo, Inc. engages in the manufacture, marketing, distribution, and sale of various beverages and convenient foods worldwide. The company operates through six segments: PepsiCo Foods North America; PepsiCo Beverages North America; International Beverages Franchise; Europe, Middle East and Africa; Latin America Foods; and Asia Pacific Foods. It offers cereals, chips, dips, granola bars, oatmeal, pasta, rice, and syrups and mixes; refrigerated dips and spreads; beverage concentrates, fountain syrups, and finished goods; and ready-to-drink tea and coffee products. The company also provides SodaStream sparkling water makers and related products, as well as various dairy products under the Agusha, Chudo, and Domik v Derevne brands. It serves wholesale and other distributors, foodservice customers, grocery stores, drug stores, convenience stores, discount/dollar stores, mass merchandisers, membership stores, hard discounters, e-commerce retailers and authorized independent bottlers, and others through a network of direct-store-delivery, customer warehouse, and distributor networks, as well as directly to consumers through e-commerce platforms and retailers. PepsiCo, Inc. was founded in 1898 and is based in Purchase, New York.",60.54172939915563,49.09827474622763,54.82000207269163,13.454769660891394,14.789319849803723,15.76552903549005,16.53211085297046,10.25925925925926,4.398820661413282,7.2442075550375815,16.16739166984069,11.028595600676818,False,False,25.775778,17.224861,,10.5499735,2.2920365,0.17865233874670827,0.4038028030971283,0.03563738667861019,0.541485227575193,0.143635879691243,0.08772957146659568,0.028259092561689236,,-0.025721386919715927,,2.4454082132706065,12.03479036574487,3.605994992645278,-0.06387983141381172,0.06610942007491687,157.49000549316406,0.0175,21.0,3.68,0.005341838582106441,0.01217694830870758,0.9382820453401003,0.9648071890842704,0.05967582667595117,0.0470055895661432,-0.3317423435288742,0.41
COST,Costco Wholesale Corporation,Consumer Staples,458086547456.0,"Costco Wholesale Corporation, together with its subsidiaries, engages in the operation of membership warehouses in the United States, Puerto Rico, Canada, Mexico, Japan, the United Kingdom, Korea, Australia, Taiwan, China, Spain, France, Iceland, New Zealand, and Sweden. It offers merchandise, including sundries, dry groceries, candies, coolers, freezers, deli, liquor, and tobacco; non-food merchandise comprising appliances, small electronics, health and beauty aids, hardware, lawn and garden, sporting goods, tires, toys and seasonal, automotive, stamps, tickets, apparel, furniture, domestics, housewares, special order kiosks, and jewelry; and fresh food, such as meat, produce, service deli, and bakery products. The company is also involved in warehouse ancillary operations, which include gasoline, pharmacies, optical, food courts, hearing-aid centers, and tire installation centers. In addition, it engages in e-commerce, business centers, travel, and other businesses. The company was formerly known as Costco Companies, Inc. and changed its name to Costco Wholesale Corporation in August 1999. Costco Wholesale Corporation was founded in 1976 and is based in Issaquah, Washington.",53.30638399045083,36.34428297658007,44.82533348351545,6.728576426474925,18.467715267110428,14.729032770499343,13.381059526366137,4.832098765432098,1.5079174997594276,3.9092401124808878,15.640847241885659,10.454179357021998,False,False,53.556305,45.937153,,27.684694,1.6002184,0.33540442941049997,0.27770539020710466,0.017108120820231592,0.12843206714262356,0.03772412665540356,0.029425763438516175,0.06640442726947482,,0.11491150545730622,,0.2802427650528048,67.42207792207792,10.204449158456036,-0.002397722163944253,0.09107426851210255,1032.030029296875,0.014199999,32.0,0.5,0.0019427817739786164,0.0033867719491635292,0.85172857867522,0.9183640873207805,0.12210054150105099,0.01997565716569477,-0.14226433283625523,0.978
WMT,Walmart Inc.,Consumer Staples,1029476384768.0,"Walmart Inc. engages in the operation of retail and wholesale stores and clubs, ecommerce websites, and mobile applications worldwide. The company operates through three segments: Walmart U.S., Walmart International, and Sam's Club U.S. It operates supercenters, supermarkets, warehouse clubs, cash and carry stores, and discount stores under Walmart and Walmart Neighborhood Market brands; membership-only warehouse clubs; and ecommerce websites, such as walmart.com.mx, walmart.ca, flipkart.com, PhonePe and other sites. It offers grocery items, including dry grocery, snacks, dairy, meat, produce, deli and bakery, frozen foods, alcoholic and nonalcoholic beverages, as well as consumables, such as health and beauty aids, pet supplies, household chemicals, paper goods, and baby products; and fuel and other categories. In addition, it is involved in the provision of health and wellness products covering pharmacy, optical and hearing services, over-the-counter drugs, and protein and nutrition products; and home, hardlines, and seasonal items, including home improvement, outdoor living, gardening, furniture, apparel, jewelry, tools and power equipment, housewares, toys, and mattresses. Further, the company offers consumer electronics and accessories, software, video games, office supplies, appliances, and third-party gift cards. Additionally, it operates digital payment platforms; offers financial services and related products, including money transfers, bill payments, money orders, check cashing, prepaid access, co-branded credit cards, installment lending, and earned wage access; and markets lines of merchandise under private and licensed brands. The company was formerly known as Wal-Mart Stores, Inc. and changed its name to Walmart Inc. in February 2018. Walmart Inc. was founded in 1945 and is based in Bentonville, Arkansas.",48.989673276603696,31.53449406101959,40.26208366881164,7.509471177386881,15.799331157194061,12.079776338897735,13.60109460312502,5.419753086419753,1.2720497824157728,2.661974616955532,12.166317252047481,10.014399323181049,False,False,47.474266,39.312214,,10.329574,1.4435358,0.14449487157529223,0.21977172570946726,0.014495718620454812,0.24926699786724774,0.041820733829433104,0.03069845182658102,0.05272290929168877,,0.23297464200402307,,0.6735296184386199,10.655591282600929,6.759999161257486,0.0,0.15513926000312445,129.1300048828125,0.0095,41.0,0.78,0.004436194046228706,0.008402825115224277,0.7382181385874593,0.9340952424930681,0.0910866552664138,0.0373575185476532,-0.17192581766298404,0.661
PM,Philip Morris International Inc.,Consumer Staples,251313012736.0,"Philip Morris International Inc. operates as a tobacco company. The company offers cigarettes and smoke-free products, including heat-not-burn, e-vapor, and oral nicotine products under the IQOS, VEEV, and ZYN brands; and consumer accessories, such as lighters and matches. It also offers wellness products. The company was incorporated in 1987 and is headquartered in Stamford, Connecticut.",65.70451109613359,56.3690807965674,61.036795946350495,20.24016635170967,16.947484639016896,12.739420188185566,15.77743991722145,9.498765432098764,9.496321917734985,13.134912912848698,13.179080533884957,11.059999999999999,True,False,22.180193,17.529118,,-25.116821,6.1826663,0.35292056632751184,-1.135481288773264,0.042433138992298614,0.6711769336744735,0.36737354851407206,0.279177327297776,0.08570152245500418,,0.07842242901394281,,-4.886431859115469,9.40957781978576,3.9760407349422615,-0.12921123331747936,-0.005182264920265668,161.25,0.0105,16.0,3.65,0.01686130797685315,-0.018181517287829574,0.787148548253674,0.8956026745211849,,0.038599685101358,-0.20969497425022401,0.451
MO,"Altria Group, Inc.",Consumer Staples,112786243584.0,"Altria Group, Inc., through its subsidiaries, manufactures and sells smokeable and oral tobacco products in the United States. It offers cigarettes primarily under the Marlboro brand; large cigars and pipe tobacco under the Black & Mild brand; moist smokeless tobacco and oral tobacco products under the Copenhagen, Skoal, Red Seal, and Husky brands; oral nicotine pouches under the on! brand; and e-vapor products under the NJOY ACE brand. The company sells its products to distributors, as well as large retail organizations, such as chain stores. Altria Group, Inc. was founded in 1822 and is headquartered in Richmond, Virginia.",65.50970150105525,62.579395396264815,64.04454844866004,22.03307211016739,10.359489674005802,14.131998531300619,18.985141185581433,12.160493827160494,12.523923572872004,10.758722080254898,15.709589249310746,11.426666666666668,True,False,16.216347,11.612054,,-32.246655,5.6003895,0.5021596816968895,-1.9837235865219873,0.0804530739889563,0.7220815333432643,0.5975967029147425,0.3449525795719748,-0.008925128591255382,,0.06420291024797797,,-7.341233580810965,10.225148683092609,4.636960609253492,-0.006512526461843766,0.09884702187037653,67.45999908447266,0.0292,12.0,6.35,0.015054722843635172,0.021465612427503555,0.7053710888108795,0.9888482204435015,,0.010725458066438254,-0.2839291117783801,0.447
MDLZ,"Mondelez International, Inc.",Consumer Staples,75839455232.0,"Mondelez International, Inc., through its subsidiaries, manufactures, markets, and sells snack food and beverage products in Latin America, North America, Asia, the Middle East, Africa, and Europe. The company provides biscuits and baked snacks, including cookies, crackers, salted snacks, snack bars, and cakes and pastries; chocolates; and gums and candies, as well as various cheese, grocery, and powdered beverage products. Its brand portfolio includes Oreo, Ritz, LU, CLIF Bar, Tate's Bake Shop biscuits and baked snacks, Cadbury Dairy Milk, Milka, and Toblerone chocolate. It serves supermarket chains, wholesalers, supercenters, club stores, mass merchandisers, distributors, convenience stores, gasoline stations, drug stores, value stores, and other retail food outlets through direct store delivery, company-owned and satellite warehouses, distribution centers, third-party distributors, and other facilities, as well as through independent sales offices and agents. The company also sells products directly to businesses and consumers through e-retail platforms, retailer digital platforms, as well as through its direct-to-consumer websites and social media platforms. Mondelez International, Inc. was formerly known as Kraft Foods Inc. and changed its name to Mondelez International, Inc. in October 2012. The company was incorporated in 2000 and is headquartered in Chicago, Illinois.",37.993315492251966,48.628207098251295,43.31076129525163,5.462556379778445,17.3936198583376,8.43181656747745,6.705322686658468,10.120987654320988,10.713809915853176,10.547515690656173,7.737975055695068,9.507918781725888,False,False,31.264551,17.539225,,2.9309063,1.9679648,0.05889601118719813,0.09486028330366128,0.04265589711982809,0.2837532760723461,0.09393569816020966,0.06360121441731323,0.06956578215167708,,-0.03376101153377331,,0.8438733648115179,6.043405676126878,2.2673317767654764,-0.09530633137085825,0.010198735666265566,59.09000015258789,0.028299998,24.0,3.4,0.039069106059318556,-0.026587542886272436,0.6517117401058962,0.9168080387947156,-0.013128999505271133,0.03318888341074811,-0.43900601675040857,0.389
CL,Colgate-Palmolive Company,Consumer Staples,69030051840.0,"Colgate-Palmolive Company, together with its subsidiaries, manufactures and sells consumer products in the United States and internationally. It operates through two segments: Oral, Personal and Home Care; and Pet Nutrition. The Oral, Personal and Home Care segment offers toothpaste, toothbrushes, mouthwash, bar and liquid hand soaps, shower gels, shampoos, conditioners, deodorants and antiperspirants, skin health products, dishwashing detergents, fabric conditioners, household cleaners, and other related items. This segment markets and sells its products under the Colgate, Palmolive, Darlie, elmex, hello, meridol, Sorriso, Tom's of Maine, EltaMD, Filorga, Irish Spring, Lady Speed Stick, PCA SKIN, Protex, Sanex, Softsoap, Speed Stick, Ajax, Axion, Fabuloso, Murphy, Soupline, and Suavitel brands to a range of traditional and eCommerce retailers, wholesalers, and distributors, as well as dentists and skin health professionals. It also offers pharmaceutical products for dentists and other oral health professionals. The Pet Nutrition segment offers pet nutrition products for everyday nutritional needs under the Hill's Science Diet brand; and a range of therapeutic pet products to help nutritionally support dogs and cats in different stages of health under the Hill's Prescription Diet brand; and a fresh pet food sold to pet specialty and other retailers in Australia under Prime100 brand. This segment markets and sells its products through pet supply retailers, veterinarians, and eCommerce retailers. Colgate-Palmolive Company was founded in 1806 and is headquartered in New York, New York.",66.36660181539399,47.9691322193119,57.16786701735295,16.423912196290928,12.325295485577744,19.502875674299617,18.114518459225707,9.274074074074074,5.525522041763341,9.55891881488768,15.504593599923526,8.106023688663285,True,False,32.590908,20.868654,,1284.1791,3.3868146,0.4274233784746971,39.48148148148148,0.052643738533226056,0.6010695711902659,0.20768324992640566,0.10460209989206162,0.042934601917500315,,0.0610023031422402,,158.40740740740742,15.853932584269662,6.710529781172493,-0.1321363582284721,0.025654851997492834,86.04000091552734,0.028299998,19.0,2.48,0.005835561956199978,0.006369730696706766,0.7974012097507452,0.944630934918599,-0.4874339988761994,0.027671474830733,-0.35967865639091734,0.331
KMB,Kimberly-Clark Corporation,Consumer Staples,32515446784.0,"Kimberly-Clark Corporation, together with its subsidiaries, manufactures and markets personal care products in the United States. It operates in two segments, North America and International Personal Care. The North America segment offers disposable diapers, training and youth pants, swimpants, baby wipes, feminine and incontinence care products, reusable underwear, facial and bathroom tissue, paper towels, napkins, wipers, tissue, towels, soaps and sanitizers, and other related products under the Huggies, Pull-Ups, Goodnites, Kotex, Poise, Depend, Kleenex, Scott, Cottonelle, Viva, Wypall , and other brand names. Its International Personal Care segment provides baby and child care, adult care and feminine care, including disposable diapers, training and youth pants, swimpants, baby wipes, feminine and incontinence care products, reusable underwear, and other related products under the Huggies, Kotex, Goodfeel, Intimus, Depend, and other brand names. The company sells its household use products directly to supermarkets, mass merchandisers, drugstores, warehouse clubs, variety and department stores, and other retail outlets, as well as through other distributors and e-commerce. It also sells its professional use products through distributors, directly to manufacturing, lodging, office building, food service, and high-volume public facilities, and through e-commerce. Kimberly-Clark Corporation was founded in 1872 and is headquartered in Dallas, Texas.",50.810881172742334,58.644470929655824,54.72767605119908,10.502137330239348,7.8118599590373785,18.363219631173248,14.133664252292355,12.350617283950616,10.116164316186769,12.608727960909684,12.91484094806844,10.654120420540314,False,False,20.156378,12.78077,,21.648619,1.9769835,0.20526742428066327,1.3455392809587217,0.050406811595973794,0.36012646683285704,0.14294400194564358,0.12287955250197605,-0.06583329792377168,-0.06583329792377168,0.01477544050045787,0.01477544050045787,4.857523302263648,9.18359375,3.328221560338453,-0.28828071725941073,-0.10070090949108516,97.95999908447266,0.133,13.0,5.23,0.014161057907008319,0.010056765266585332,0.8370296716696465,0.90297752811914,0.40032078609699684,0.06919194989967775,-0.36591931347983253,0.296
GIS,"General Mills, Inc.",Consumer Staples,19612784640.0,"General Mills, Inc. manufactures and markets branded consumer foods in the United States and internationally. The company operates through four segments: North America Retail; International; North America Pet; and North America Foodservice. It offers grain, ready-to-eat cereals, refrigerated yogurt, soup, meal kits, refrigerated and frozen dough products, dessert and baking mixes, bakery flour, frozen pizza and pizza snacks, snack bars, fruit and savory snacks, ice cream and frozen desserts, unbaked and fully baked frozen dough products, frozen hot snacks, ethnic meals, side dish mixes, frozen breakfast and entrees, nutrition bars, and frozen and shelf-stable vegetables. The company also manufactures and markets pet food products, including dog and cat food; and operates ice cream parlors. It markets its products under the Annies, Betty Crocker, Bisquick, Blue Buffalo, Bugles, Cascadian Farm, Cheerios, Chex, Cinnamon Toast Crunch, Cocoa Puffs, Cookie Crisp, Dunkaroos, Edgard & Cooper, Fiber One, By The Foot, Gushers, Roll-Ups, Gardettos, Gold Medal, Golden Grahams, Häagen-Dazs, Kitano, Kix, Lärabar, Latina, Lucky Charms, As Well As Muir Glen, Nature Valley, Nudges, Oatmeal Crisp, Old El Paso, Pillsbury, Progresso, Tastefuls, Tiki Pets, Total, Totinos, Trix, True Chews, True Solutions, Wanchai Ferry, Wheaties, Wilderness, and Yoki brands. In addition, the company sells its products to grocery stores, mass merchandisers, membership stores, natural food chains, drug, dollar and discount chains, e-commerce retailers, commercial and noncommercial foodservice distributors and operators, restaurants, convenience stores, and pet specialty stores. The company was founded in 1866 and is headquartered in Minneapolis, Minnesota.",49.68486059831453,63.47767153389795,56.58126606610624,10.956423423017025,8.280183265062298,15.945616645571626,14.502637264663578,12.45432098765432,13.988083654987328,16.07998225111465,14.090253420102158,6.865031220039491,False,False,8.98533,11.16329,,3.549353,1.0675833,0.10865205157641204,0.2494999565179581,0.11690843712848722,0.345519485184691,0.16869027947410015,0.11778350250941673,0.00859240120451843,0.00859240120451843,-0.053556446819100656,-0.053556446819100656,1.6628293764675188,5.989795918367347,2.254257109997392,-0.2961597724049806,-0.17791649316623848,36.75,0.0913,19.0,6.67,0.013726264681028126,-0.0027009845838586455,0.9307553590161249,0.9755109736206342,-0.044413093807038395,0.03208871737501668,0.24239065231883533,0.0
K,K,Consumer Staples,,,50.0,46.81666666666666,48.40833333333333,12.5,12.5,12.5,12.5,10.0,8.0,10.0,10.0,8.816666666666666,False,False,,,,,,,,,,,,,,,,,,,,,,,,0.0,,,,,,,,
